document_id,document_name,document_source_url,document_content_type,document_md5_sum,translated,has_valid_text,author,geography_iso,types,date,author_is_party,collection_id,family_id,family_name,family_slug,role,variant,status,num_text_blocks,num_pages
UNFCCC.non-party.263.0,Climate Action Pathway. Human Settlements. Action Table,https://unfccc.int/sites/default/files/resource/HS_ActionTable_2.1.pdf,application/pdf,2f3d5c26d8d9d5d5eccbcf7072305f71,False,True,['Marrakech Partnership'],nan,['Publication'],2021-07-21,False,,UNFCCC.family.263.0,Climate Action Pathway. Human Settlements. Action Table,climate-action-pathway-human-settlements-action-table_a621,,,,803,80
UNFCCC.party.1221.0,"Statement by the Republic of Turkey regarding the report entitled ""National Greenhouse Gas Inventory 2021"" of the Greek Cypriot side",https://unfccc.int/sites/default/files/resource/Statement%20of%20Turkey-National%20Greenhouse%20Gas%20Inventory%202021%20of%20the%20Greek%20Cypriot%20side%20%281%29.pdf,application/pdf,9d2e803396ea95f00490ba7f96bd7957,False,True,['Türkiye'],TUR,['Statement'],2021-06-28,True,,UNFCCC.family.1221.0,"Statement by the Republic of Turkey regarding the report entitled ""National Greenhouse Gas Inventory 2021"" of the Greek Cypriot side",statement-by-the-republic-of-turkey-regarding-the-report-entitled-national-greenhouse-gas-inventory-2021-of-the-greek-cypriot-side_d0de,,,,8,1
UNFCCC.party.1570.0,Vanuatu. National communication (NC). NC 3.,https://unfccc.int/sites/default/files/resource/Vanuatu%20Third%20National%20Communication%20Report.pdf,application/pdf,1efa9e6f6bea9428ef926d4a47fe17e2,False,True,['Vanuatu'],VUT,['National Communication'],2021-03-22,True,,UNFCCC.family.1570.0,Vanuatu. National communication (NC). NC 3.,vanuatu-national-communication-nc-nc-3_669b,,,,1631,186
UNFCCC.party.1096.0,Saint Vincent and the Grenadines First NDC,https://unfccc.int/sites/default/files/NDC/2022-06/Saint%20Vincent%20and%20the%20Grenadines_NDC.pdf,application/pdf,cbb9a03ca4c0772dbcb8dfe286ae8cc5,False,True,['Saint Vincent and the Grenadines'],VCT,['Nationally Determined Contribution'],2016-06-29,True,,UNFCCC.family.1096.0,Saint Vincent and the Grenadines First NDC,saint-vincent-and-the-grenadines-first-ndc_933e,,,,125,14
UNFCCC.party.1470.0,Togo. National Communication (NC). NC 4.,https://unfccc.int/sites/default/files/resource/QUATRIEME%20OMMUNICATION%20%20NATIONALE%20DU%20TOGO%20SUR%20LES%20CHANGEMENTS%20CLIMATIQUES.pdf,application/pdf,f35b86b04c2ca4b81d4633dc05395962,True,True,['Togo'],TGO,['National Communication'],2022-06-08,True,,UNFCCC.family.1470.0,Togo. National Communication (NC). NC 4.,togo-national-communication-nc-nc-4_06fa,,,,1156,204
UNFCCC.party.94.0,Austria. National Communication (NC). NC 7.,https://unfccc.int/sites/default/files/resource/69823015_Austria-NC7-1-AT_NC7.pdf,application/pdf,46305bda80c133bf2772c7c1ffe9b5a6,False,True,['Austria'],AUT,['National Communication'],2018-02-08,True,,UNFCCC.family.94.0,Austria. National Communication (NC). NC 7.,austria-national-communication-nc-nc-7_2040,,,,1124,156
UNFCCC.party.149.0,Bolivia (Plurinational State of) First NDC,https://unfccc.int/sites/default/files/NDC/2022-06/INDC-Bolivia-english.pdf,application/pdf,3381ce7c33fe6757562393cda930d96e,False,True,['Bolivia'],BOL,['Nationally Determined Contribution'],2016-10-05,True,,UNFCCC.family.149.0,Bolivia (Plurinational State of) First NDC,bolivia-plurinational-state-of-first-ndc_5d2c,,,,172,17
UNFCCC.party.1513.0,Ukraine. National Communication (NC). NC 6.,https://unfccc.int/sites/default/files/resource/U%206nc_v7_final_%5B1%5D.pdf,application/pdf,6e436dfc86ba41ba87032051b07ac7c1,True,True,['Ukraine'],UKR,['National Communication'],2013-12-30,True,,UNFCCC.family.1513.0,Ukraine. National Communication (NC). NC 6.,ukraine-national-communication-nc-nc-6_4e9a,,,,2327,342
UNFCCC.party.718.0,Kyrgyzstan First NDC (Updated submission),https://unfccc.int/sites/default/files/NDC/2022-06/%D0%9E%D0%9D%D0%A3%D0%92%20ENG%20%D0%BE%D1%82%2008102021.pdf,application/pdf,f58c02cd4167ef3cae3f6999d9793709,False,True,['Kyrgyzstan'],KGZ,['Nationally Determined Contribution'],2021-10-09,True,,UNFCCC.family.718.0,Kyrgyzstan First NDC (Updated submission),kyrgyzstan-first-ndc-updated-submission_eca2,,,,203,41
UNFCCC.party.870.0,Namibia. National communication (NC). NC 4.,https://unfccc.int/sites/default/files/resource/Namibia%20-%20NC4%20-%20Final%20signed.pdf,application/pdf,3e39381b6e27fe92d98df7a85fe9da99,False,True,['Namibia'],NAM,['National Communication'],2020-03-24,True,,UNFCCC.family.870.0,Namibia. National communication (NC). NC 4.,namibia-national-communication-nc-nc-4_179b,,,,1912,251
UNFCCC.party.970.0,Norway's Adaptation communication,https://unfccc.int/sites/default/files/resource/Adaptation%20Communication%20Norway.pdf,application/pdf,6e4c99daa581375008e02628019136c7,False,True,['Norway'],NOR,['Adaptation Communication'],2021-05-03,True,,UNFCCC.family.970.0,Norway's Adaptation communication,norway-s-adaptation-communication_0064,,,,410,46
UNFCCC.non-party.1273.0,Submission to UNFCCC First Global Stocktake from The Global Carbon Project within the Future Earth research initiative,https://unfccc.int/sites/default/files/resource/202203011247---Global%20Carbon%20Project_submission_Feb2022.pdf,application/pdf,9c0d5962e7c247b867a29d1a0039dd6c,False,True,"['Global Carbon Project (GCP)', 'Future Earth']",nan,['Submission to the Global Stocktake'],2022-04-13,False,,UNFCCC.family.1273.0,Submission to UNFCCC First Global Stocktake from The Global Carbon Project within the Future Earth research initiative,submission-to-unfccc-first-global-stocktake-from-the-global-carbon-project-within-the-future-earth-research-initiative_374c,,,,32,7
UNFCCC.party.383.0,Denmark. Biennial Reports (BR). BR 3. National Communication (NC). NC 7.,https://unfccc.int/sites/default/files/resource/8057126_Denmark-NC7-BR3-2-NC7-DNK-Denmarks-NC7-and-BR3_1January2018-12MB.pdf,application/pdf,2d876403c97bad409f3d8a597150ac37,False,True,['Denmark'],DNK,"['National Communication', 'Biennial Report']",2018-01-19,True,,UNFCCC.family.383.0,Denmark. Biennial Reports (BR). BR 3. National Communication (NC). NC 7.,denmark-biennial-reports-br-br-3-national-communication-nc-nc-7_3649,,,,5971,705
UNFCCC.party.1088.0,Saint Kitts and Nevis First NDC (Updated submission),https://unfccc.int/sites/default/files/NDC/2022-06/St.%20Kitts%20and%20Nevis%20Revised%20NDC_Updated.pdf,application/pdf,19a38864a595f306243166a6f046ccb6,False,True,['Saint Kitts and Nevis'],KNA,['Nationally Determined Contribution'],2021-10-25,True,,UNFCCC.family.1088.0,Saint Kitts and Nevis First NDC (Updated submission),saint-kitts-and-nevis-first-ndc-updated-submission_22d9,,,,142,29
UNFCCC.party.665.0,Italy's Adaptation communication,https://unfccc.int/sites/default/files/resource/UNFCCC_Italy_2021.pdf,application/pdf,58925320dcda966e75710c210843229f,False,True,['Italy'],ITA,['Adaptation Communication'],2021-11-12,True,,UNFCCC.family.665.0,Italy's Adaptation communication,italy-s-adaptation-communication_3699,,,,176,14
UNFCCC.non-party.1373.0,Technical analysis of the second biennial update report of Montenegro submitted on 3 May 2019. Summary report by the team of technical experts,https://unfccc.int/sites/default/files/resource/tasr2019_MNE.pdf,application/pdf,7f5eac3ca0bca6427295b62acc6c5d05,False,True,['UNFCCC Secretariat'],nan,['Technical Analysis Summary Report'],2020-01-22,False,,UNFCCC.family.1373.0,Technical analysis of the second biennial update report of Montenegro submitted on 3 May 2019. Summary report by the team of technical experts,technical-analysis-of-the-second-biennial-update-report-of-montenegro-submitted-on-3-may-2019-summary-report-by-the-team-of-technical-experts_44c0,,,,164,23
UNFCCC.party.765.0,Long-Term Strategy on Energy and Climate Change 2020-2050,https://unfccc.int/sites/default/files/resource/AND_LTS_Nov2021.pdf,application/pdf,f7843dd684739fc4fb865e895b6c0e2b,False,True,['Andorra'],AND,['Long-Term Low-Emission Development Strategy'],2021-11-10,True,,UNFCCC.family.765.0,Long-Term Strategy on Energy and Climate Change 2020-2050,long-term-strategy-on-energy-and-climate-change-2020-2050_2dec,,,,403,54
UNFCCC.non-party.1695.0,Call for inputs for the first global stocktake Submitted by Climate Strategies on behalf of South to South Just Transitions project,https://unfccc.int/sites/default/files/resource/202303131854---S2S%20Input_Final.pdf,application/pdf,e501834854f119318e2054ee51bcaec2,False,True,['Climate Strategies'],nan,['Submission to the Global Stocktake'],2023-03-14,False,,UNFCCC.family.1695.0,Call for inputs for the first global stocktake Submitted by Climate Strategies on behalf of South to South Just Transitions project,call-for-inputs-for-the-first-global-stocktake-submitted-by-climate-strategies-on-behalf-of-south-to-south-just-transitions-project_5999,,,,92,13
UNFCCC.party.1010.0,Paraguay. Biennial update report (BUR). BUR 3. National inventory report.,https://unfccc.int/sites/default/files/resource/2021_IIN_PY%20Versi%C3%B3n%20Final_compressed.pdf,application/pdf,26f96dd4455899eefd74e3d82168d7cc,True,True,['Paraguay'],PRY,['National Inventory Report'],2022-08-03,True,,UNFCCC.family.1010.0,Paraguay. Biennial update report (BUR). BUR 3. National inventory report.,paraguay-biennial-update-report-bur-bur-3-national-inventory-report_2aec,,,,5346,582
UNFCCC.party.1110.0,Saudi Arabia. Biennial update report (BUR). BUR 1.,https://unfccc.int/sites/default/files/resource/18734625_Saudi%20Arabia-BUR1-1-BUR1-Kingdom%20of%20Saudi%20Arabia.pdf,application/pdf,9ee9e43be119733a23d96d2a65c3dc08,False,True,['Saudi Arabia'],SAU,['Biennial Update Report'],2018-04-03,True,,UNFCCC.family.1110.0,Saudi Arabia. Biennial update report (BUR). BUR 1.,saudi-arabia-biennial-update-report-bur-bur-1_32f9,,,,1141,152
UNFCCC.party.12.0,AILAC - Submission to the First Global Stocktake Second Information Gathering Phase / Second Technical Dialogue,https://unfccc.int/sites/default/files/resource/202210211110---AILAC%20Submsion%20on%20GST_TD1.2.pdf,application/pdf,935943b92a6304e16d7fbc7599970fc7,False,True,['Independent Alliance of Latin America and the Caribbean (AILAC)'],XAB,['Submission to the Global Stocktake'],2022-10-26,True,,UNFCCC.family.12.0,AILAC - Submission to the First Global Stocktake Second Information Gathering Phase / Second Technical Dialogue,ailac-submission-to-the-first-global-stocktake-second-information-gathering-phase-second-technical-dialogue_9b77,,,,138,20
UNFCCC.non-party.398.0,"Draft Technical paper: Priorities and needs: technologies for adaptation in agriculture, water resources and coastal zones; including experiences in stakeholder engagement and regulatory issues pertaining to the development, transfer and uptake of technologies in those sectors (AC20)",https://unfccc.int/sites/default/files/resource/ac20_7b_technologies.pdf,application/pdf,c69cb0d498425416fc41289f3034eb62,False,True,['UNFCCC Adaptation Committee'],nan,['Intersessional Document'],2021-09-02,False,,UNFCCC.family.398.0,"Draft Technical paper: Priorities and needs: technologies for adaptation in agriculture, water resources and coastal zones; including experiences in stakeholder engagement and regulatory issues pertaining to the development, transfer and uptake of technologies in those sectors (AC20)",draft-technical-paper-priorities-and-needs-technologies-for-adaptation-in-agriculture-water-resources-and-coastal-zones-including-experiences-in-stakeholder-engagement-and-regulatory-issues-pertaining-to-the-development-transfer-and-uptake-of-technologies-in-those-sectors-ac20_6e6c,,,,282,25
UNFCCC.non-party.298.0,Climate Change 2022: Mitigation of Climate Change: Summary for Policymakers,https://www.ipcc.ch/report/ar6/wg3/downloads/report/IPCC_AR6_WGIII_SummaryForPolicymakers.pdf,application/pdf,a25fa3a050d77f19279031e19901ffca,False,True,['IPCC'],nan,['IPCC Report'],2022-04-04,False,,UNFCCC.family.291.0,Climate Change 2022: Mitigation of Climate Change,climate-change-2022-mitigation-of-climate-change_33ea,,,,349,50
UNFCCC.party.437.0,Eswatini's Adaptation communication,https://unfccc.int/sites/default/files/resource/eswatini-climate-change-adaptation-plan-unfccc.pdf,application/pdf,a2e79e14ce64d5cdb7c1acc0358adca2,False,True,['Eswatini'],SWZ,['Adaptation Communication'],2021-11-01,True,,UNFCCC.family.437.0,Eswatini's Adaptation communication,eswatini-s-adaptation-communication_edc8,,,,196,29
UNFCCC.party.366.0,Cyprus. 2022 National Inventory Report (NIR),https://unfccc.int/sites/default/files/resource/cyp-2022-nir-5apr22.zip,,,True,False,['Cyprus'],CYP,['National Inventory Report'],2022-04-06,True,,UNFCCC.family.366.0,Cyprus. 2022 National Inventory Report (NIR),cyprus-2022-national-inventory-report-nir_981a,,,,0,0
UNFCCC.party.680.0,"Japan's Fast-Start Finance for Developing Countries up to 2012 (As of 29 February, 2012)",http://unfccc.int/files/cooperation_support/financial_mechanism/fast_start_finance/application/pdf/annex_japan_fsf(as_of_feb_2012).pdf,application/pdf,81fca317be401f28833cadf3dc459e1a,False,True,['Japan'],JPN,['Fast-Start Finance Report'],2012-11-21,True,,UNFCCC.family.680.0,"Japan's Fast-Start Finance for Developing Countries up to 2012 (As of 29 February, 2012)",japan-s-fast-start-finance-for-developing-countries-up-to-2012-as-of-29-february-2012_21b3,,,,1,3
UNFCCC.party.537.0,Gambia Second NDC,https://unfccc.int/sites/default/files/NDC/2022-06/Second%20NDC%20of%20The%20Republic%20of%20The%20Gambia-16-12-2021.pdf,application/pdf,f703ab883775d307e831772fb1b03b25,False,True,['Gambia'],GMB,['Nationally Determined Contribution'],2021-09-12,True,,UNFCCC.family.537.0,Gambia Second NDC,gambia-second-ndc_8eb3,,,,268,35
UNFCCC.non-party.1396.0,Technical analysis of the third biennial update report of Montenegro submitted on 7 February 2022. Summary report by the team of technical experts,https://unfccc.int/sites/default/files/resource/tasr2022_MNE.pdf,application/pdf,de2d2b78063a6fdc92bf012ae8cf6ded,False,True,['UNFCCC Secretariat'],nan,['Technical Analysis Summary Report'],2023-01-12,False,,UNFCCC.family.1396.0,Technical analysis of the third biennial update report of Montenegro submitted on 7 February 2022. Summary report by the team of technical experts,technical-analysis-of-the-third-biennial-update-report-of-montenegro-submitted-on-7-february-2022-summary-report-by-the-team-of-technical-experts_8122,,,,174,22
UNFCCC.party.266.0,Climate Action Plan 2050. Executive summary,https://unfccc.int/sites/default/files/klimaschutzplan_2050_ru_bf.pdf,application/pdf,5f644b778d076ba60a79ead9c0698596,True,True,['Germany'],DEU,['Long-Term Low-Emission Development Strategy'],2016-11-14,True,,UNFCCC.family.266.0,Climate Action Plan 2050. Executive summary,climate-action-plan-2050-executive-summary_64c2,,,,190,9
UNFCCC.party.780.0,Malaysia First NDC (Archived),https://unfccc.int/sites/default/files/NDC/2022-06/INDC%20Malaysia%20Final%2027%20November%202015%20Revised%20Final%20UNFCCC.pdf,application/pdf,dc8962b833e61276eb28f20986ae90dc,False,True,['Malaysia'],MYS,['Nationally Determined Contribution'],2016-11-16,True,,UNFCCC.family.780.0,Malaysia First NDC (Archived),malaysia-first-ndc-archived_d754,,,,51,6
UNFCCC.non-party.1121.0,"Secretariat GST synthesis report: Synthesis report for the technical assessment component of the first global stocktake: Synthesis report on the state of adaptation efforts, experiences and priorities",https://unfccc.int/sites/default/files/resource/Synthesis%20report%20on%20the%20state%20of%20adaptation%20efforts%2C%20experiences%20and%20priorities.pdf,application/pdf,8fe5761fde2bdf5ba98848f51fe7a55c,False,True,['UNFCCC Secretariat'],nan,['Synthesis Report'],2022-04-29,False,,UNFCCC.family.1121.0,"Secretariat GST synthesis report: Synthesis report for the technical assessment component of the first global stocktake: Synthesis report on the state of adaptation efforts, experiences and priorities",secretariat-gst-synthesis-report-synthesis-report-for-the-technical-assessment-component-of-the-first-global-stocktake-synthesis-report-on-the-state-of-adaptation-efforts-experiences-and-priorities_dc0f,,,,569,69
UNFCCC.party.995.0,Panama First NDC (Updated submission),https://unfccc.int/sites/default/files/NDC/2022-06/CDN1%20Actualizada%20Rep%C3%BAblica%20de%20Panam%C3%A1.pdf,application/pdf,e892e59fdcb06157bfd77b32c0236dfc,True,True,['Panama'],PAN,"['Nationally Determined Contribution', 'Adaptation Communication']",2020-12-28,True,,UNFCCC.family.995.0,Panama First NDC (Updated submission),panama-first-ndc-updated-submission_c9cb,,,,669,69
UNFCCC.non-party.386.0,Designing a meaningful global stocktake. Center for Climate and Energy Solutions (C2ES),https://unfccc.int/sites/default/files/resource/202202281810---C2ES_EDF%20Mitigation%20Landscape%20Analysis%20Themes%20and%20Trends.pdf,application/pdf,aaff09f3d6ba4c1a628d6417200ef58b,False,True,['Center for Climate and Energy Solutions (C2ES)'],nan,['Submission to the Global Stocktake'],2022-04-01,False,,UNFCCC.family.386.0,Designing a meaningful global stocktake. Center for Climate and Energy Solutions (C2ES),designing-a-meaningful-global-stocktake-center-for-climate-and-energy-solutions-c2es_9ec3,,,,1025,104
UNFCCC.non-party.131.0,Benefits of measurement-based methane estimates and timely emissions reductions for reaching the long-term global goal on temperature: Submission to the Global Stocktake by the Environmental Defense Fund,https://unfccc.int/sites/default/files/resource/202208040943---Environmental%20Defense%20Fund_GST%2004.08.22.pdf,application/pdf,5f78f0beedfc344dc1ed02732156eb4b,False,True,['Environmental Defense Fund (EDF)'],nan,['Submission to the Global Stocktake'],2022-08-05,False,,UNFCCC.family.131.0,Benefits of measurement-based methane estimates and timely emissions reductions for reaching the long-term global goal on temperature: Submission to the Global Stocktake by the Environmental Defense Fund,benefits-of-measurement-based-methane-estimates-and-timely-emissions-reductions-for-reaching-the-long-term-global-goal-on-temperature-submission-to-the-global-stocktake-by-the-environmental-defense-fund_da5d,,,,928,74
UNFCCC.non-party.660.0,Israel. Technical analysis of the first biennial update report of Israel submitted on 18 April 2016.,https://unfccc.int/sites/default/files/resource/docs/2016/tasr/isr.pdf,application/pdf,1458ec85abf1f79db3d1f520f1c07e37,False,True,['UNFCCC Secretariat'],nan,['Technical Analysis Summary Report'],2017-03-01,False,,UNFCCC.family.660.0,Israel. Technical analysis of the first biennial update report of Israel submitted on 18 April 2016.,israel-technical-analysis-of-the-first-biennial-update-report-of-israel-submitted-on-18-april-2016_d4be,,,,147,22
UNFCCC.non-party.286.0,Annex IV: Contributors to the Working Group II Contribution to the IPCC Sixth Assessment Report,https://www.ipcc.ch/report/ar6/wg2/downloads/report/IPCC_AR6_WGII_Annex-IV.pdf,application/pdf,0fff46e4a9ef9f9419c6f70966c45638,False,True,['IPCC'],nan,['IPCC Report'],2022-02-01,False,,UNFCCC.family.283.0,"Climate Change 2022: Impacts, Adaptation and Vulnerability",climate-change-2022-impacts-adaptation-and-vulnerability_1f01,,,,289,26
UNFCCC.non-party.1042.0,Record of the facilitative sharing of views at the fifty - second to fifty - fifth session of the Subsidiary Body for Implementation: Cambodia (FSVR1),https://unfccc.int/sites/default/files/resource/FSVR1_KHM.pdf,application/pdf,1ccbd630781791d1dc945d6d4b00c815,False,True,['UNFCCC Secretariat'],nan,['Facilitative Sharing of Views Report'],2022-01-21,False,,UNFCCC.family.1042.0,Record of the facilitative sharing of views at the fifty - second to fifty - fifth session of the Subsidiary Body for Implementation: Cambodia (FSVR1),record-of-the-facilitative-sharing-of-views-at-the-fifty-second-to-fifty-fifth-session-of-the-subsidiary-body-for-implementation-cambodia-fsvr1_3847,,,,58,4
UNFCCC.non-party.1713.0,Submission by Climate Analytics (CA) Caribbean and the Caribbean Natural Resources Institute (CANARI) on behalf of the Caribbean Climate Justice Alliance (CCJA),https://unfccc.int/sites/default/files/GST/2023-03/202303141712---Climate%20Analytics-CANARI-CCJA%20Submission%20to%20UNFCCC%20Global%20Stocktake%202023%20%281%29.pdf,application/pdf,a85462efa3c52bb935accd902dc28c7a,False,True,['Climate Analytics'],nan,['Submission to the Global Stocktake'],2023-03-23,False,,UNFCCC.family.1713.0,Submission by Climate Analytics (CA) Caribbean and the Caribbean Natural Resources Institute (CANARI) on behalf of the Caribbean Climate Justice Alliance (CCJA),submission-by-climate-analytics-ca-caribbean-and-the-caribbean-natural-resources-institute-canari-on-behalf-of-the-caribbean-climate-justice-alliance-ccja_f6f5,,,,46,5
UNFCCC.party.454.0,European Union. Biennial report (BR). BR 4,https://unfccc.int/sites/default/files/resource/European%20Union-BR4_C_2019_8832_and_SWD_2019_432_2.pdf,application/pdf,a836e108367b90ef943371fdfc1494e9,False,True,['European Union'],EUR,['Biennial Report'],2020-06-09,True,,UNFCCC.family.454.0,European Union. Biennial report (BR). BR 4,european-union-biennial-report-br-br-4_7d01,,,,1164,278
UNFCCC.party.305.0,Colombia First NDC (Updated submission),https://unfccc.int/sites/default/files/NDC/2022-06/NDC%20actualizada%20de%20Colombia.pdf,application/pdf,adaa4de050b2256500756d76ff551c3a,True,True,['Colombia'],COL,"['Nationally Determined Contribution', 'Adaptation Communication']",2020-12-30,True,,UNFCCC.family.305.0,Colombia First NDC (Updated submission),colombia-first-ndc-updated-submission_bbe3,,,,517,112
UNFCCC.non-party.1613.0,"Addendum to the synthesis report for the technical assessment component of the first global stocktake: State of adaptation efforts, experiences and priorities",https://unfccc.int/sites/default/files/resource/GST_SR_23b_Addendum_Final_20230417.pdf,application/pdf,775b8fafbdcfc8b1f2c104a5dd01b409,False,True,['UNFCCC Secretariat'],nan,['Submission to the Global Stocktake'],2023-04-17,False,,UNFCCC.family.1613.0,"Addendum to the synthesis report for the technical assessment component of the first global stocktake: State of adaptation efforts, experiences and priorities",addendum-to-the-synthesis-report-for-the-technical-assessment-component-of-the-first-global-stocktake-state-of-adaptation-efforts-experiences-and-priorities_6550,,,,101,12
UNFCCC.non-party.975.0,Oceans and Coastal Zones Action Table (unedited),https://unfccc.int/sites/default/files/resource/OceansAndCoastalZones_ActionTable_2.1_uneditedversion.pdf,application/pdf,ac070e6136fb8003514633b137109df7,False,True,['UNFCCC Secretariat'],nan,['Publication'],2021-11-09,False,,UNFCCC.family.975.0,Oceans and Coastal Zones Action Table (unedited),oceans-and-coastal-zones-action-table-unedited_5ef8,,,,861,73
UNFCCC.party.554.0,Ghana. Biennial update report (BUR). BUR3.,https://unfccc.int/sites/default/files/resource/gh_BUR3_1282021_submission.pdf,application/pdf,f73091cd9ca7c6064619bfdb372e360e,False,True,['Ghana'],GHA,['Biennial Update Report'],2021-08-13,True,,UNFCCC.family.554.0,Ghana. Biennial update report (BUR). BUR3.,ghana-biennial-update-report-bur-bur3_6452,,,,734,126
UNFCCC.party.205.0,Canada First NDC (Archived),https://unfccc.int/sites/default/files/NDC/2022-06/Premi%C3%A8re%20CDN%20du%20Canada%20-%20Soumission%20r%C3%A9vis%C3%A9e%202017-05-11.pdf,application/pdf,017c41ffb21093fb00d5decf9104ec7a,True,True,['Canada'],CAN,['Nationally Determined Contribution'],2017-05-11,True,,UNFCCC.family.205.0,Canada First NDC (Archived),canada-first-ndc-archived_142b,,,,44,10
UNFCCC.party.1595.0,Zambia First NDC (Archived),https://unfccc.int/sites/default/files/NDC/2022-06/FINAL%2BZAMBIA%27S%2BINDC_1.pdf,application/pdf,b96dc97791d842f4285fede55fb1ccce,False,True,['Zambia'],ZMB,['Nationally Determined Contribution'],2016-12-09,True,,UNFCCC.family.1594.0,Zambia First NDC (Archived),zambia-first-ndc-archived_354f,,,,69,12
UNFCCC.party.429.0,Estonia. National Communication (NC). NC 7.,https://unfccc.int/sites/default/files/resource/734568021_Estonia-NC7-2-NC7_EST_resubmission.pdf,application/pdf,b39cb01cd030b7a4650d520c25730535,False,True,['Estonia'],EST,['National Communication'],2018-03-09,True,,UNFCCC.family.429.0,Estonia. National Communication (NC). NC 7.,estonia-national-communication-nc-nc-7_1c89,,,,2418,253
UNFCCC.party.378.0,Democratic Republic of the Congo First NDC (Updated submission),https://unfccc.int/sites/default/files/NDC/2022-06/CDN%20Revis%C3%A9e%20de%20la%20RDC.pdf,application/pdf,a86673ef5603229c9de3cb6cb0d938f1,True,True,['Democratic Republic of Congo'],COD,['Nationally Determined Contribution'],2021-12-28,True,,UNFCCC.family.378.0,Democratic Republic of the Congo First NDC (Updated submission),democratic-republic-of-the-congo-first-ndc-updated-submission_96c7,,,,542,102
UNFCCC.party.1073.0,Romania. National Communication (NC). NC 7.,https://unfccc.int/sites/default/files/resource/0587134_Romania-NC7-1-NC7_ROMANIA.pdf,application/pdf,d9e2801e676d03827cd6a41e4f879716,False,True,['Romania'],ROU,['National Communication'],2017-12-27,True,,UNFCCC.family.1071.0,Romania. National Communication (NC). NC 7.,romania-national-communication-nc-nc-7_2f4d,,,,2946,273
UNFCCC.party.1495.0,Tuvalu First NDC,https://unfccc.int/sites/default/files/NDC/2022-06/TUVALU%20INDC.pdf,application/pdf,2c451e21860653e45c9955c557a6c4ab,False,True,['Tuvalu'],TUV,['Nationally Determined Contribution'],2016-04-22,True,,UNFCCC.family.1495.0,Tuvalu First NDC,tuvalu-first-ndc_6ab4,,,,54,10
UNFCCC.party.71.0,Letter of the Minister of Environment in relation to the updated first NDC,https://unfccc.int/sites/default/files/NDC/2022-06/Letter%20of%20the%20Minister%20of%20Environment.pdf,application/pdf,bf69fb1a694a02a659058e6fbe858cb6,False,True,['Armenia'],ARM,['Nationally Determined Contribution'],2021-05-05,True,,UNFCCC.family.70.0,Armenia First NDC (Updated submission),armenia-first-ndc-updated-submission_ce8d,,,,0,1
