document_id,document_name,document_source_url,document_content_type,document_md5_sum,translated,has_valid_text,author,geography_iso,types,date,author_is_party,collection_id,family_id,family_name,family_slug,role,variant,status,num_text_blocks,num_pages
UNFCCC.party.1147.0,Slovakia. National Communication (NC). NC 8. Biennial Reports (BR). BR 5.,https://unfccc.int/sites/default/files/resource/SVK_8NC_5BR.pdf,application/pdf,27233c8f06e173384e85c3e6345f6f76,False,True,['Slovakia'],SVK,"['National Communication', 'Biennial Report']",2023-02-06,True,,UNFCCC.family.1147.0,Slovakia. National Communication (NC). NC 8. Biennial Reports (BR). BR 5.,slovakia-national-communication-nc-nc-8-biennial-reports-br-br-5_12e7,,,,2796,327
UNFCCC.party.1293.0,Sweden's Adaptation communication,https://unfccc.int/sites/default/files/ACR/2022-11/ADCOM_Sweden_November_221114.pdf,application/pdf,cefda1ab589fbb284dbf8047453db56e,False,True,['Sweden'],SWE,['Adaptation Communication'],2022-11-15,True,,UNFCCC.family.1293.0,Sweden's Adaptation communication,sweden-s-adaptation-communication_0e64,,,,465,55
UNFCCC.party.198.0,Cambodia. National Communication (NC). NC 2.,https://unfccc.int/sites/default/files/resource/khmnc2.pdf,application/pdf,e20c0916bb27c198123b79b124ec8ecb,False,True,['Cambodia'],KHM,['National Communication'],2016-01-13,True,,UNFCCC.family.198.0,Cambodia. National Communication (NC). NC 2.,cambodia-national-communication-nc-nc-2_3de2,,,,1015,115
UNFCCC.party.1024.0,Poland. Biennial Reports (BR). BR 3. National Communication (NC). NC 7.,https://unfccc.int/sites/default/files/resource/8193245_Poland-BR3-NC7-1-NC7-BR3%20Poland.pdf,application/pdf,80b91fcf49b0e144cdd9b9223311d9b3,False,True,['Poland'],POL,"['National Communication', 'Biennial Report']",2017-12-29,True,,UNFCCC.family.1024.0,Poland. Biennial Reports (BR). BR 3. National Communication (NC). NC 7.,poland-biennial-reports-br-br-3-national-communication-nc-nc-7_a721,,,,2140,281
UNFCCC.party.26.0,Andorra First NDC (Archived),https://unfccc.int/sites/default/files/NDC/2022-06/Andorra%20INDC-CPDN.pdf,application/pdf,4a806cf9be7883f202bcae037eb4dd7c,True,True,['Andorra'],AND,['Nationally Determined Contribution'],2017-03-24,True,,UNFCCC.family.26.0,Andorra First NDC (Archived),andorra-first-ndc-archived_b673,,,,73,6
UNFCCC.party.1124.0,Senegal. National Communication (NC). NC 3.,https://unfccc.int/sites/default/files/resource/Sennc3.pdf,application/pdf,a05872ed63be02e6feb7d4a434f6c5b7,True,True,['Senegal'],SEN,['National Communication'],2016-01-08,True,,UNFCCC.family.1124.0,Senegal. National Communication (NC). NC 3.,senegal-national-communication-nc-nc-3_8ae8,,,,2052,204
UNFCCC.non-party.1744.0,Political declaration of the high-level meeting on the midterm review of the Sendai Framework for Disaster Risk Reduction 2015–2030,https://unfccc.int/sites/default/files/GST/2023-06/A-RES-77-289%20-%20Political%20Declaration%20-%20Midterm%20Review%20Sendai%20Framework.pdf,application/pdf,,False,True,['United Nations Office for Disaster Risk Reduction (UNDRR)'],nan,['Submission to the Global Stocktake'],2023-06-20,False,,nan,Political declaration of the high-level meeting on the midterm review of the Sendai Framework for Disaster Risk Reduction 2015–2030,nan,,,,121,10
UNFCCC.party.1059.0,Republic Of Moldova. Biennial update report (BUR). BUR 2.,https://unfccc.int/sites/default/files/resource/Moldova_BUR2_EN_web_27.12.2018_0.pdf,application/pdf,df05619fad0cec1093bfef465b7f2cbe,False,True,['Moldova'],MDA,['Biennial Update Report'],2018-12-27,True,,UNFCCC.family.1059.0,Republic Of Moldova. Biennial update report (BUR). BUR 2.,republic-of-moldova-biennial-update-report-bur-bur-2_d48e,,,,2858,222
UNFCCC.party.352.0,Costa Rica. National communication (NC). NC 4.,https://unfccc.int/sites/default/files/resource/CuartaComunicacionCC202_Costa%20Rica.pdf,application/pdf,d226d1f55b5fb874c88fec8a82f3ea37,True,True,['Costa Rica'],CRI,['National Communication'],2021-12-16,True,,UNFCCC.family.352.0,Costa Rica. National communication (NC). NC 4.,costa-rica-national-communication-nc-nc-4_7c74,,,,2804,285
UNFCCC.non-party.1644.0,Submission to the GST: Adaptation Research Alliance (ARA) & Climate and Development Knowledge Network (CDKN),https://unfccc.int/sites/default/files/resource/202303071454---Submission_UNFCCC%20Global%20Stocktake%20S.pdf,application/pdf,d8864a6d4d74f0cb0ca3968a7395ce05,False,True,"['SouthSouthNorth (SSN)', 'Adaptation Research Alliance (ARA)']",nan,['Submission to the Global Stocktake'],2023-03-09,False,,UNFCCC.family.1644.0,Submission to the GST: Adaptation Research Alliance (ARA) & Climate and Development Knowledge Network (CDKN),submission-to-the-gst-adaptation-research-alliance-ara-climate-and-development-knowledge-network-cdkn_01bf,,,,6,1
UNFCCC.non-party.1115.0,"Second Submission Of The High-Level Champions To The Global Stocktake, ahead of the 2nd meeting of the Technical Dialogue (TD1.2)",https://unfccc.int/sites/default/files/resource/202208081009---20220805%20HLCs%20Updated%20submission_TD1-2.pdf,application/pdf,a6c86c4fec726301d97367554a3e056a,False,True,['High-Level Champions for Climate Action'],nan,['Submission to the Global Stocktake'],2022-08-08,False,,UNFCCC.family.1115.0,"Second Submission Of The High-Level Champions To The Global Stocktake, ahead of the 2nd meeting of the Technical Dialogue (TD1.2)",second-submission-of-the-high-level-champions-to-the-global-stocktake-ahead-of-the-2nd-meeting-of-the-technical-dialogue-td1-2_e905,,,,214,23
UNFCCC.party.503.0,Finland. Biennial report (BR). BR 4,https://unfccc.int/sites/default/files/resource/FI_BR4_TK_2019-12-19.pdf,application/pdf,48a3624e983c0e90fe8aee6f9d299816,False,True,['Finland'],FIN,['Biennial Report'],2019-12-20,True,,UNFCCC.family.503.0,Finland. Biennial report (BR). BR 4,finland-biennial-report-br-br-4_05d9,,,,841,100
UNFCCC.party.1159.0,Somalia's Updated NDC,https://unfccc.int/sites/default/files/NDC/2022-06/Final%20Updated%20NDC%20for%20Somalia%202021.pdf,application/pdf,3a60ae822580a83ab04915cc1c27fcbd,False,True,['Somalia'],SOM,"['Nationally Determined Contribution', 'National Communication']",2022-09-07,True,,UNFCCC.family.1159.0,Somalia's Updated NDC,somalia-s-updated-ndc_8ef8,,,,82,16
UNFCCC.non-party.480.0,Facilitative sharing of views record - BUR3 Singapore,https://unfccc.int/sites/default/files/resource/FSVR3_SGP.pdf,application/pdf,7556dafa296f9b0ba4903e7598443eaf,False,True,['UNFCCC Secretariat'],nan,['Facilitative Sharing of Views Report'],2021-04-09,False,,UNFCCC.family.480.0,Facilitative sharing of views record - BUR3 Singapore,facilitative-sharing-of-views-record-bur3-singapore_5036,,,,37,4
UNFCCC.non-party.646.0,International Cryosphere Climate Initiative (ICCI): Submission to the First Global Stocktake,https://unfccc.int/sites/default/files/resource/First%20Submission%20ICCI.pdf,application/pdf,617943c71f5de963d2cd6c73c097c111,False,True,['International Cryosphere Climate Initiative (ICCI)'],nan,['Submission to the Global Stocktake'],2022-05-02,False,,UNFCCC.family.646.0,International Cryosphere Climate Initiative (ICCI): Submission to the First Global Stocktake,international-cryosphere-climate-initiative-icci-submission-to-the-first-global-stocktake_a8d3,,,,33,3
UNFCCC.non-party.1635.0,University of Exeter - National land use change: Carbon emissions,https://unfccc.int/sites/default/files/resource/202303061935---National_LandUseChange_Carbon_Emissions_2022v1.0.xlsx,,,False,False,['University of Exeter'],nan,['Submission to the Global Stocktake'],2023-03-07,False,,UNFCCC.family.1635.0,University of Exeter - National land use change: Carbon emissions,university-of-exeter-national-land-use-change-carbon-emissions_782b,,,,0,0
UNFCCC.party.572.0,Grenada First NDC (Archived),https://unfccc.int/sites/default/files/NDC/2022-06/Grenada%20INDC.pdf,application/pdf,27b7ffeba6e498be4376b75c20e55d4d,False,True,['Grenada'],GRD,['Nationally Determined Contribution'],2016-04-22,True,,UNFCCC.family.572.0,Grenada First NDC (Archived),grenada-first-ndc-archived_4a8e,,,,75,11
UNFCCC.party.223.0,Central African Republic First NDC (Archived),https://unfccc.int/sites/default/files/NDC/2022-06/INDC_R%C3%A9publique%20Centrafricaine_EN.pdf,application/pdf,a1e116d054f38915389586386ab18abf,False,True,['Central African Republic'],CAF,['Nationally Determined Contribution'],2016-10-11,True,,UNFCCC.family.223.0,Central African Republic First NDC (Archived),central-african-republic-first-ndc-archived_34c1,,,,127,15
UNFCCC.non-party.1064.0,Resilience Pathway Vision And Summary,https://unfccc.int/sites/default/files/resource/Resilience_Vision%26Summary.pdf,application/pdf,c06d91c81ec9e76cc71e2f423585f42e,False,True,['Marrakech Partnership'],nan,['Publication'],2021-11-09,False,,UNFCCC.family.1064.0,Resilience Pathway Vision And Summary,resilience-pathway-vision-and-summary_b4c0,,,,148,11
UNFCCC.party.194.0,Cambodia. Biennial update report (BUR). BUR 1 - Technical Annex I,https://unfccc.int/sites/default/files/resource/FBUR_Cambodia.pdf,application/pdf,22ef731a98537d2a983ac42f5cc343b6,False,True,['Cambodia'],KHM,['Biennial Update Report'],2020-08-13,True,,UNFCCC.family.194.0,Cambodia. Biennial update report (BUR). BUR 1.,cambodia-biennial-update-report-bur-bur-1_40c1,,,,1706,207
UNFCCC.party.1028.0,Portugal. Biennial report (BR). BR 4,https://unfccc.int/sites/default/files/resource/200401_PT_4BR_final.pdf,application/pdf,316db1b7ddea5ff85eb9ad51040d46e6,False,True,['Portugal'],PRT,['Biennial Report'],2020-04-01,True,,UNFCCC.family.1028.0,Portugal. Biennial report (BR). BR 4,portugal-biennial-report-br-br-4_0082,,,,730,70
UNFCCC.non-party.1582.0,Voces de América Latina y el Caribe sobre Acción Climática en el Transporte,https://unfccc.int/sites/default/files/resource/202212201028---Voces%20de%20LAC%20sobre%20accio%CC%81n%20clima%CC%81tica%20en%20el%20transporte.pdf,application/pdf,9d05d240d2b495ac07ac801e5a256c59,True,True,"['Partnership on Sustainable', 'Low Carbon Transport (SLOCAT)']",nan,['Submission to the Global Stocktake'],2023-01-17,False,,UNFCCC.family.1582.0,Voces de América Latina y el Caribe sobre Acción Climática en el Transporte,voces-de-america-latina-y-el-caribe-sobre-accion-climatica-en-el-transporte_6233,,,,13,1
UNFCCC.non-party.1119.0,"Secretariat GST synthesis report: Synthesis report for the technical assessment component of the first global stocktake: Synthesis report on finance flows, including the information referred to in Article 2, paragraph 1(c), and means of implementation and support and mobilization and provision of support, including the information referred to in Article 9, paragraphs 4 and 6, Article 10, paragraph 6, Article 11, paragraph 3, and Article 13, in particular paragraphs 9 and 10, of the Paris Agreement",https://unfccc.int/sites/default/files/resource/GST_SR_23d_MOI.pdf,application/pdf,a858c2dc8507939d2c00e5062107b5ac,False,True,['UNFCCC Secretariat'],nan,['Synthesis Report'],2022-04-20,False,,UNFCCC.family.1119.0,"Secretariat GST synthesis report: Synthesis report for the technical assessment component of the first global stocktake: Synthesis report on finance flows, including the information referred to in Article 2, paragraph 1(c), and means of implementation and support and mobilization and provision of support, including the information referred to in Article 9, paragraphs 4 and 6, Article 10, paragraph 6, Article 11, paragraph 3, and Article 13, in particular paragraphs 9 and 10, of the Paris Agreement",secretariat-gst-synthesis-report-synthesis-report-for-the-technical-assessment-component-of-the-first-global-stocktake-synthesis-report-on-finance-flows-including-the-information-referred-to-in-article-2-paragraph-1-c-and-means-of-implementation-and-support-and-mobilization-and-provision-of-support-including-the-information-referred-to-in-article-9-paragraphs-4-and-6-article-10-paragraph-6-article-11-paragraph-3-and-article-13-in-particular-paragraphs-9-and-10-of-the-paris-agreement_a037,,,,725,84
UNFCCC.party.57.0,Argentina First NDC (Archived),https://unfccc.int/sites/default/files/17112016%20NDC%20Revisada%202016.pdf,application/pdf,c5a597a25dfd0c851c9968a53cdb95ad,True,True,['Argentina'],ARG,['Nationally Determined Contribution'],2016-11-17,True,,UNFCCC.family.57.0,Argentina First NDC (Archived),argentina-first-ndc-archived_ea61,,,,96,11
UNFCCC.non-party.1648.0,Submission to the technical phase of the Global Stocktake 2021-2023 Performance distributions to assess collective progress in reducing greenhouse gas emissions - New Climate Institute for Climate Policy and Global Sustainability,https://unfccc.int/sites/default/files/resource/202303031643---032023_NewClimateInstitute_PerformanceDistributions.pdf,application/pdf,5abb0aef9e2dec9c9633c5ff4e5f046e,False,True,['New Climate Institute for Climate Policy and Global Sustainability'],nan,['Submission to the Global Stocktake'],2023-03-08,False,,UNFCCC.family.1648.0,Submission to the technical phase of the Global Stocktake 2021-2023 Performance distributions to assess collective progress in reducing greenhouse gas emissions - New Climate Institute for Climate Policy and Global Sustainability,submission-to-the-technical-phase-of-the-global-stocktake-2021-2023-performance-distributions-to-assess-collective-progress-in-reducing-greenhouse-gas-emissions-new-climate-institute-for-climate-policy-and-global-sustainability_ff10,,,,215,22
UNFCCC.party.1155.0,Solomon Islands. National Communication (NC). NC 2.,https://unfccc.int/sites/default/files/resource/SI%20SNC%20FINAL_1-1.pdf,application/pdf,c1021551dd359cbbbcb64318795e0149,False,True,['Solomon Islands'],SLB,['National Communication'],2017-09-14,True,,UNFCCC.family.1155.0,Solomon Islands. National Communication (NC). NC 2.,solomon-islands-national-communication-nc-nc-2_2511,,,,1624,173
UNFCCC.party.1604.0,Zimbabwe's Initial Adaptation Communication,https://unfccc.int/sites/default/files/ACR/2022-10/zimbabwe-adcom-2022_final.pdf,application/pdf,94a6800dd0bc92c99afd6f61d1116935,False,True,['Zimbabwe'],ZWE,['Adaptation Communication'],2022-10-18,True,,UNFCCC.family.1604.0,Zimbabwe's Adaptation Communication,zimbabwe-s-adaptation-communication_0d6c,,,,616,65
UNFCCC.non-party.1019.0,Plymouth Marine Laboratory (PML) submission to the first Global Stocktake,https://unfccc.int/sites/default/files/resource/202202251003---2022%20GST%20submission%20Plymouth%20Marine%20Laboratory.pdf,application/pdf,68a8826478bc84e8f9ce782255782c9f,False,True,['Plymouth Marine Laboratory (PML)'],nan,['Submission to the Global Stocktake'],2022-04-13,False,,UNFCCC.family.1019.0,Plymouth Marine Laboratory (PML) submission to the first Global Stocktake,plymouth-marine-laboratory-pml-submission-to-the-first-global-stocktake_445b,,,,25,5
UNFCCC.non-party.1748.0,Technical analysis of the third biennial update report of Colombia submitted on 14 January 2022. Summary report by the team of technical experts.,https://unfccc.int/sites/default/files/resource/tasr3_2022_COL.pdf,application/pdf,,False,True,['UNFCCC Secretariat'],COL,['Technical Analysis Summary Report'],2023-07-12,False,,nan,Technical analysis of the third biennial update report of Colombia submitted on 14 January 2022. Summary report by the team of technical experts.,nan,,,,210,25
UNFCCC.party.1055.0,Republic of Korea. National communication (NC). NC4.,https://unfccc.int/sites/default/files/resource/Fourth%20National%20Communication%20of%20the%20ROK%20under%20the%20UNFCCC.pdf,application/pdf,57129d1aecb5e99ee16082265a62c764,False,True,['South Korea'],KOR,['National Communication'],2019-12-03,True,,UNFCCC.family.1055.0,Republic of Korea. National communication (NC). NC4.,republic-of-korea-national-communication-nc-nc4_0da5,,,,1233,120
UNFCCC.party.1704.0,Technical analysis of the fourth biennial update report of the Republic of Korea submitted on 30 December 2021. Summary report by the team of technical experts,https://unfccc.int/sites/default/files/resource/tasr2022_KOR.pdf,application/pdf,87c54e790b64d627778aaf931a1608bf,False,True,['South Korea'],KOR,['Technical Analysis Summary Report'],2023-03-21,True,,UNFCCC.family.1704.0,Technical analysis of the fourth biennial update report of the Republic of Korea submitted on 30 December 2021. Summary report by the team of technical experts,technical-analysis-of-the-fourth-biennial-update-report-of-the-republic-of-korea-submitted-on-30-december-2021-summary-report-by-the-team-of-technical-experts_38dd,,,,188,26
UNFCCC.party.1136.0,Singapore First NDC (Updated submission),https://unfccc.int/sites/default/files/NDC/2022-06/Singapore%27s%20Update%20of%201st%20NDC.pdf,application/pdf,f9c3a1f49bc16e0dfce9de2f1096865e,False,True,['Singapore'],SGP,['Nationally Determined Contribution'],2020-03-31,True,,UNFCCC.family.1136.0,Singapore First NDC (Updated submission),singapore-first-ndc-updated-submission_a1a7,,,,91,25
UNFCCC.party.1036.0,Qatar First NDC (Archived),https://unfccc.int/sites/default/files/NDC/2022-06/Qatar%20INDCs%20Report%20-English.pdf,application/pdf,3f9690b9bb70424d931ef460c7aeb1c3,False,True,['Qatar'],QAT,['Nationally Determined Contribution'],2017-06-23,True,,UNFCCC.family.1036.0,Qatar First NDC (Archived),qatar-first-ndc-archived_d401,,,,145,6
UNFCCC.party.1281.0,Suriname First NDC(Archived),https://unfccc.int/sites/default/files/NDC/2022-06/Suriname%20First%20NDC.pdf,application/pdf,0cb105b9423208f88db3b9a763f4dfa4,False,True,['Suriname'],SUR,['Nationally Determined Contribution'],2019-02-13,True,,UNFCCC.family.1281.0,Suriname First NDC(Archived),suriname-first-ndc-archived_5795,,,,37,12
UNFCCC.party.511.0,Four-page overview of revised national low carbon strategy of France,https://unfccc.int/sites/default/files/resource/en_SNBC-2_summary_4-pages.pdf,application/pdf,6c3e3657e3b915de7bd2d7efa54d55fe,False,True,['France'],FRA,['Long-Term Low-Emission Development Strategy'],2021-02-15,True,,UNFCCC.family.510.0,Four-page overview of revised national low carbon strategy of France,four-page-overview-of-revised-national-low-carbon-strategy-of-france_38c0,,,,42,3
UNFCCC.party.240.0,China First NDC (Updated submission),https://unfccc.int/sites/default/files/NDC/2022-06/China%E2%80%99s%20Achievements%2C%20New%20Goals%20and%20New%20Measures%20for%20Nationally%20Determined%20Contributions.pdf,application/pdf,10593bf1668b43e682a3431cc8f19105,False,True,['China'],CHN,"['Nationally Determined Contribution', 'Adaptation Communication']",2021-10-28,True,,UNFCCC.family.239.0,China First NDC (Updated submission),china-first-ndc-updated-submission_e0ca,,,,366,62
UNFCCC.non-party.1656.0,"Submission by IDDRI on behalf of the Adaptation Without Borders global partnership, relating to the 3rd Technical Dialogue of the UNFCCC Global Stocktake - Accounting for transboundary climate risks in the Global Stocktake to drive regional and global cooperation on adaptation",https://unfccc.int/sites/default/files/resource/202303062039---Submission%20TD3%20_Transboundary%20Climate%20Risks_%2C%20March%202023_Final.pdf,application/pdf,ed699bf954c4a3db0f09706e90c4d71d,False,True,"['Institute for Sustainable Development and International Relations (IDDRI)', 'External organization authors']",nan,['Submission to the Global Stocktake'],2023-03-07,False,,UNFCCC.family.1656.0,"Submission by IDDRI on behalf of the Adaptation Without Borders global partnership, relating to the 3rd Technical Dialogue of the UNFCCC Global Stocktake - Accounting for transboundary climate risks in the Global Stocktake to drive regional and global cooperation on adaptation",submission-by-iddri-on-behalf-of-the-adaptation-without-borders-global-partnership-relating-to-the-3rd-technical-dialogue-of-the-unfccc-global-stocktake-accounting-for-transboundary-climate-risks-in-the-global-stocktake-to-drive-regional-and-global-cooperation-on-adaptation_a84b,,,,28,4
UNFCCC.party.49.0,Antigua and Barbuda First NDC (Updated submission),https://unfccc.int/sites/default/files/NDC/2022-06/ATG%20-%20UNFCCC%20NDC%20-%202021-09-02%20-%20Final.pdf,application/pdf,a83d804c59793d244977b76c85b9e5eb,False,True,['Antigua and Barbuda'],ATG,['Nationally Determined Contribution'],2021-09-02,True,,UNFCCC.family.49.0,Antigua and Barbuda First NDC (Updated submission),antigua-and-barbuda-first-ndc-updated-submission_11bc,,,,337,63
UNFCCC.party.411.0,El Salvador First NDC (Archived),https://unfccc.int/sites/default/files/NDC/2022-06/EL%20SALVADOR-INTENDED%20NATIONALLY%20DETERMINED%20CONTRIBUTION.pdf,application/pdf,79efe109e741033b7e2638ba7a2404ee,True,True,['El Salvador'],SLV,['Nationally Determined Contribution'],2017-03-27,True,,UNFCCC.family.411.0,El Salvador First NDC (Archived),el-salvador-first-ndc-archived_d6ba,,,,112,14
UNFCCC.party.340.0,Contribución Nacionalmente Determinada del Estado Plurinacional de Bolivia 2021-2030,https://unfccc.int/sites/default/files/NDC/2022-06/CND%20Bolivia%202021-2030.pdf,application/pdf,295ac58956847889a380808dc4731258,True,True,['Bolivia'],BOL,['Nationally Determined Contribution'],2022-04-15,True,,UNFCCC.family.340.0,Contribución Nacionalmente Determinada del Estado Plurinacional de Bolivia 2021-2030,contribucion-nacionalmente-determinada-del-estado-plurinacional-de-bolivia-2021-2030_e2ba,,,,624,64
UNFCCC.non-party.174.0,"Bulletin of Multi-scale Estimation of Greenhouse Gas Budgets. National Institute for Environmental Studies, Japan Agency for Marine-Earth Science and Technology, Japan Meteorological Research Institute, Japan Chiba University",https://unfccc.int/sites/default/files/resource/202203011207---GST_NIES_GHGbudget_202202.pdf,application/pdf,2c0f6aebb919449108f6c044b24461a7,False,True,"['National Institute for Environmental Studies (NIES) Japan', 'Japan Agency for Marine-Earth Science and Technology (JAMSTEC)', 'Japan Meteorological Research Institute (MRI)', 'Chiba University']",nan,['Submission to the Global Stocktake'],2022-04-01,False,,UNFCCC.family.174.0,"Bulletin of Multi-scale Estimation of Greenhouse Gas Budgets. National Institute for Environmental Studies, Japan Agency for Marine-Earth Science and Technology, Japan Meteorological Research Institute, Japan Chiba University",bulletin-of-multi-scale-estimation-of-greenhouse-gas-budgets-national-institute-for-environmental-studies-japan-agency-for-marine-earth-science-and-technology-japan-meteorological-research-institute-japan-chiba-university_94ad,,,,124,18
UNFCCC.party.1117.0,Seconde Contribution Déterminée au Niveau National (République Gabonaise),https://unfccc.int/sites/default/files/NDC/2022-07/20220706_Gabon_Updated%20NDC.pdf,application/pdf,7432c7f9b2982f2032682ffc8a011cff,True,True,['Gabon'],GAB,['Nationally Determined Contribution'],2022-07-06,True,,UNFCCC.family.1117.0,Seconde Contribution Déterminée au Niveau National (République Gabonaise),seconde-contribution-determinee-au-niveau-national-republique-gabonaise_e943,,,,275,29
UNFCCC.party.15.0,Albania First NDC (Updated submission),https://unfccc.int/sites/default/files/2022-08/Albania%20Revised%20NDC.pdf,application/pdf,1090dd9cc584b81c47414ba00d6632db,False,True,['Albania'],ALB,['Nationally Determined Contribution'],2021-10-12,True,,UNFCCC.family.15.0,Albania First NDC (Updated submission),albania-first-ndc-updated-submission_3204,,,,865,145
UNFCCC.party.1017.0,Philippines First NDC,https://unfccc.int/sites/default/files/NDC/2022-06/Philippines%20-%20NDC.pdf,application/pdf,92192549e376b0ab4e659de0edf7a044,False,True,['Philippines'],PHL,['Nationally Determined Contribution'],2021-04-15,True,,UNFCCC.family.1017.0,Philippines First NDC,philippines-first-ndc_226c,,,,115,5
UNFCCC.party.992.0,Palestine's National Adaptation Plan,https://unfccc.int/sites/default/files/resource/National%20Adaptation%20Plan_%20State%20of%20Palestine_0.pdf,application/pdf,c89592ac51561536de5cc023cc461f24,False,True,['Palestine'],PSE,['National Communication'],2016-11-11,True,,UNFCCC.family.992.0,Palestine's National Adaptation Plan,palestine-s-national-adaptation-plan_1de5,,,,1603,217
UNFCCC.non-party.1391.0,Technical analysis of the third biennial update report of Ghana submitted on 12 August 2021,https://unfccc.int/sites/default/files/resource/tasr2021_GHA.pdf,application/pdf,01fc473e566cce3e7daf53b60f711687,False,True,['UNFCCC Secretariat'],nan,['Technical Analysis Summary Report'],2022-07-20,False,,UNFCCC.family.1391.0,Technical analysis of the third biennial update report of Ghana submitted on 12 August 2021,technical-analysis-of-the-third-biennial-update-report-of-ghana-submitted-on-12-august-2021_0a9e,,,,189,24
UNFCCC.party.530.0,Gabon. Biennial update report (BUR). BUR 1.,https://unfccc.int/sites/default/files/resource/PRBA%20%20Gabon.pdf,application/pdf,a198df7a30f6eeebd76f8161ef094fb0,True,True,['Gabon'],GAB,['Biennial Update Report'],2021-12-29,True,,UNFCCC.family.529.0,Gabon. Biennial update report (BUR). BUR 1.,gabon-biennial-update-report-bur-bur-1_3c54,,,,1301,221
UNFCCC.non-party.1677.0,The First Global Stocktake International Renewable Energy Agency (IRENA) Submission March 2023,https://unfccc.int/sites/default/files/resource/202303061704---IRENA%20Submission%20Global%20Stocktake%20March%202023.pdf,application/pdf,9091a58809b4933c28329978dd13f645,False,True,['International Renewable Energy Agency (IRENA)'],nan,['Submission to the Global Stocktake'],2023-03-08,False,,UNFCCC.family.1677.0,The First Global Stocktake International Renewable Energy Agency (IRENA) Submission March 2023,the-first-global-stocktake-international-renewable-energy-agency-irena-submission-march-2023_e74a,,,,295,32
UNFCCC.party.787.0,Maldives. National Communication (NC). NC 2.,https://unfccc.int/sites/default/files/resource/SNC%20PDF_Resubmission.pdf,application/pdf,a641fc6c93a4ab04d1b3aaf5d64d9dd6,False,True,['Maldives'],MDV,['National Communication'],2018-08-28,True,,UNFCCC.family.787.0,Maldives. National Communication (NC). NC 2.,maldives-national-communication-nc-nc-2_aa91,,,,1343,163
