document_id,document_name,document_source_url,document_content_type,document_md5_sum,translated,has_valid_text,author,geography_iso,types,date,author_is_party,collection_id,family_id,family_name,family_slug,role,variant,status,num_text_blocks,num_pages
UNFCCC.party.1152.0,Slovenia. National Communication (NC). NC 8. Biennial Reports (BR). BR 5.,https://unfccc.int/sites/default/files/resource/8NCin5BR_v3_EN%20-%20MOPE%20FINAL%20-%20IJS%20%E2%80%93%20clean.docx,,,True,False,['Slovenia'],SVN,"['National Communication', 'Biennial Report']",2023-02-16,True,,UNFCCC.family.1152.0,Slovenia. National Communication (NC). NC 8. Biennial Reports (BR). BR 5.,slovenia-national-communication-nc-nc-8-biennial-reports-br-br-5_2af8,,,,0,0
UNFCCC.party.1031.0,Portugal. National Communication (NC). NC 8. Biennial Reports (BR). BR 5.,https://unfccc.int/sites/default/files/resource/221228_PORTUGAL_8CN5BR.pdf,application/pdf,d65a3f3454a035ff864a9a61a21449c6,False,True,['Portugal'],PRT,"['National Communication', 'Biennial Report']",2022-12-29,True,,UNFCCC.family.1030.0,Portugal. National Communication (NC). NC 8. Biennial Reports (BR). BR 5.,portugal-national-communication-nc-nc-8-biennial-reports-br-br-5_2159,,,,2853,313
UNFCCC.party.1286.0,Suriname. National Communication (NC). NC 2.,https://unfccc.int/sites/default/files/resource/Surnc2rev.pdf,application/pdf,bd9ca52bffbabbc8f5487908f60a4204,False,True,['Suriname'],SUR,['National Communication'],2016-03-15,True,,UNFCCC.family.1286.0,Suriname. National Communication (NC). NC 2.,suriname-national-communication-nc-nc-2_0475,,,,4074,284
UNFCCC.party.1131.0,Seychelles. National Communication (NC). NC 2.,https://unfccc.int/sites/default/files/resource/Second%20National%20Communication_Seychelles.pdf,application/pdf,e5aa256dfef0810c15a47976d7ab99e6,False,True,['Seychelles'],SYC,['National Communication'],2013-04-14,True,,UNFCCC.family.1131.0,Seychelles. National Communication (NC). NC 2.,seychelles-national-communication-nc-nc-2_3aa4,,,,2711,375
UNFCCC.party.33.0,Angola. National communication (NC). NC 2.,https://unfccc.int/sites/default/files/resource/ANGOLA%20SNC.pdf,application/pdf,fed7f0b38c034986d6cdc21895b6b376,False,True,['Angola'],AGO,['National Communication'],2021-11-05,True,,UNFCCC.family.33.0,Angola. National communication (NC). NC 2.,angola-national-communication-nc-nc-2_4832,,,,2367,330
UNFCCC.non-party.622.0,IIASA Policy Brief 31: United scenarios - Submissions to the Global Stocktake,https://unfccc.int/sites/default/files/resource/202112070944---PB31.pdf,application/pdf,97f30ee4388a99202a6ec95d35dfa2d2,False,True,['International Institute for Applied Systems Analysis (IIASA)'],nan,['Submission to the Global Stocktake'],2022-04-22,False,,UNFCCC.family.622.0,IIASA Policy Brief 31: United scenarios - Submissions to the Global Stocktake,iiasa-policy-brief-31-united-scenarios-submissions-to-the-global-stocktake_d37c,,,,44,4
UNFCCC.party.347.0,Costa Rica. Biennial update report (BUR). BUR 2 - Technical Annex I,https://unfccc.int/sites/default/files/resource/AnexoTecnico%20REDD.pdf,application/pdf,1b208454f270329d3d97e7c5aa09b781,False,True,['Costa Rica'],CRI,['Biennial Update Report'],2019-12-23,True,,UNFCCC.family.347.0,Costa Rica. Biennial update report (BUR). BUR 2.,costa-rica-biennial-update-report-bur-bur-2_6429,,,,376,64
UNFCCC.party.416.0,El Salvador. National Communication (NC). NC 3.,https://unfccc.int/sites/default/files/resource/904768351_El%20Salvador-NC3-1-TCN%202018%20web.pdf,application/pdf,e26b7b5494d95c8cc05cb3d3b514678a,True,True,['El Salvador'],SLV,['National Communication'],2018-09-29,True,,UNFCCC.family.415.0,El Salvador. National Communication (NC). NC 3.,el-salvador-national-communication-nc-nc-3_21e7,,,,1765,250
UNFCCC.non-party.1751.0,Technical analysis of the first biennial update report of Malawi submitted on 22 December 2021. Summary report by the team of technical experts,http://example.com,application/pdf,,False,True,['UNFCCC Secretariat'],MWI,['Technical Analysis Summary Report'],2023-08-09,False,,nan,Technical analysis of the first biennial update report of Malawi submitted on 22 December 2021. Summary report by the team of technical experts,nan,,,,561,24
UNFCCC.party.247.0,China's submission to the global stocktake,https://unfccc.int/sites/default/files/resource/202212011137---China_s%20Submission%20on%20the%20Global%20Stocktake.pdf,application/pdf,523239714d7dcef77499e8bc57f0e352,False,True,['China'],CHN,['Submission to the Global Stocktake'],2022-12-05,True,,UNFCCC.family.247.0,China's submission to the global stocktake,china-s-submission-to-the-global-stocktake_214a,,,,66,12
UNFCCC.party.516.0,France. Biennial report (BR). BR 4,https://unfccc.int/sites/default/files/resource/BR-EN-resubmission.pdf,application/pdf,6629b2fd966e7e49db3151cc5f55da1d,False,True,['France'],FRA,['Biennial Report'],2020-05-15,True,,UNFCCC.family.516.0,France. Biennial report (BR). BR 4,france-biennial-report-br-br-4_e56f,,,,735,150
UNFCCC.non-party.1651.0,The First Global Stocktake: International Energy Agency (IEA) submission,https://unfccc.int/sites/default/files/resource/202303081402---IEA%20Updated%20Submission%20to%20the%20First%20Global%20Stocktake.pdf,application/pdf,9045b33733c12646b6e06e3e0958e5a1,False,True,['International Energy Agency (IEA)'],nan,['Submission to the Global Stocktake'],2023-03-09,False,,UNFCCC.family.1651.0,The First Global Stocktake: International Energy Agency (IEA) submission,the-first-global-stocktake-international-energy-agency-iea-submission_07c3,,,,111,18
UNFCCC.party.1532.0,United States Mid-Century Strategy for Deep Carbonization. Documentation and Output,https://unfccc.int/sites/default/files/us_mcs_documentation_and_output.pdf,application/pdf,a4ee1af3818ff609001e8da75a90d40b,False,True,['United States of America'],USA,['Long-Term Low-Emission Development Strategy'],2016-11-16,True,,UNFCCC.family.1532.0,United States Mid-Century Strategy for Deep Carbonization. Documentation and Output,united-states-mid-century-strategy-for-deep-carbonization-documentation-and-output_0b9b,,,,385,78
UNFCCC.party.168.0,Brunei Darussalam First NDC,https://unfccc.int/sites/default/files/NDC/2022-06/Brunei%20Darussalam%27s%20NDC%202020.pdf,application/pdf,54be10f4a2f887c49b3f08e4cbb8b147,False,True,['Brunei Darussalam'],BRN,['Nationally Determined Contribution'],2020-12-31,True,,UNFCCC.family.167.0,Brunei Darussalam First NDC,brunei-darussalam-first-ndc_6aa8,,,,93,14
UNFCCC.non-party.1198.0,Summary for Policymakers,https://www.ipcc.ch/site/assets/uploads/sites/2/2022/06/SPM_version_report_LR.pdf,application/pdf,a7a7979f91b48c91f8b3ac91849b5551,False,True,['IPCC'],nan,['IPCC Report'],2018-10-01,False,,UNFCCC.family.1192.0,Special Report on Global Warming of 1.5 ºC,special-report-on-global-warming-of-1-5-oc_4bfd,,,,111,24
UNFCCC.party.739.0,Lesotho. National Communication (NC). NC 2.,https://unfccc.int/sites/default/files/resource/LESOTHO%20SNC%20FINAL%20REPORT%20November%202013%20final.pdf,application/pdf,6cb8c09991603e6fc4252a62743b9c1d,False,True,['Lesotho'],LSO,['National Communication'],2013-11-20,True,,UNFCCC.family.739.0,Lesotho. National Communication (NC). NC 2.,lesotho-national-communication-nc-nc-2_a50a,,,,1123,145
UNFCCC.non-party.1252.0,"Submission for the First Global Stocktake Submitted by: Nationally Determined Contributions (NDCs) Working Group, YOUNGO, Care About Climate",https://unfccc.int/sites/default/files/resource/202203051640---YOUNGO_NDCs%20WG_GST%20Submission%20%281%29.pdf,application/pdf,239af83077451798a9f900750fb71a61,False,True,"['Youth Non-Governmental Organizations (YOUNGO)', 'Nationally Determined Contributions (NDCs) Working Group', 'Care About Climate (CAC)']",nan,['Submission to the Global Stocktake'],2022-04-13,False,,UNFCCC.family.1252.0,"Submission for the First Global Stocktake Submitted by: Nationally Determined Contributions (NDCs) Working Group, YOUNGO, Care About Climate",submission-for-the-first-global-stocktake-submitted-by-nationally-determined-contributions-ndcs-working-group-youngo-care-about-climate_ee8a,,,,55,5
UNFCCC.party.115.0,Belarus First NDC (Updated submission),https://unfccc.int/sites/default/files/NDC/2022-06/Belarus_Letter.pdf,application/pdf,a3b0517359449dc033b17ccacceb79ad,False,True,['Belarus'],BLR,['Nationally Determined Contribution'],2021-10-11,True,,UNFCCC.family.115.0,Belarus First NDC (Updated submission),belarus-first-ndc-updated-submission_3cb1,,,,2,1
UNFCCC.non-party.1403.0,Technical analysis of the third biennial update report of the Republic of Moldova submitted on 21 December 2021. Summary report by the team of technical experts,https://unfccc.int/sites/default/files/resource/tasr2022_MDA.pdf,application/pdf,7f1371b6f07a56c03b0fcc097796335b,False,True,['UNFCCC Secretariat'],nan,['Technical Analysis Summary Report'],2022-11-08,False,,UNFCCC.family.1403.0,Technical analysis of the third biennial update report of the Republic of Moldova submitted on 21 December 2021. Summary report by the team of technical experts,technical-analysis-of-the-third-biennial-update-report-of-the-republic-of-moldova-submitted-on-21-december-2021-summary-report-by-the-team-of-technical-experts_6c15,,,,181,24
UNFCCC.non-party.53.0,AR6 Synthesis Report: Annex I: Glossary,https://www.ipcc.ch/report/ar6/syr/downloads/report/IPCC_AR6_SYR_Annex-I.pdf,application/pdf,92ef8fd6c52f3e1f37c979fe3acefc36,False,True,['IPCC'],nan,['IPCC Report'],2023-03-01,False,,UNFCCC.family.53.0,AR6 Synthesis Report,ar6-synthesis-report_25b0,,,,330,18
UNFCCC.non-party.1352.0,Technical analysis of the first biennial update report of Uzbekistan submitted on 5 July 2021. Summary report by the team of technical experts,https://unfccc.int/sites/default/files/resource/tasr2021_UZB.pdf,application/pdf,d12ab1aaf4b6c5a9d4701637981a7329,False,True,['UNFCCC Secretariat'],nan,['Technical Analysis Summary Report'],2022-07-21,False,,UNFCCC.family.1352.0,Technical analysis of the first biennial update report of Uzbekistan submitted on 5 July 2021. Summary report by the team of technical experts,technical-analysis-of-the-first-biennial-update-report-of-uzbekistan-submitted-on-5-july-2021-summary-report-by-the-team-of-technical-experts_2c7c,,,,181,23
UNFCCC.party.744.0,Liberia. National communication (NC). NC 2.,https://unfccc.int/sites/default/files/resource/SNC.pdf,application/pdf,a5b64adfa2b4c1e2390edc3ed2aed590,False,True,['Liberia'],LBR,['National Communication'],2021-04-06,True,,UNFCCC.family.744.0,Liberia. National communication (NC). NC 2.,liberia-national-communication-nc-nc-2_3163,,,,1834,271
UNFCCC.party.851.0,Morocco First NDC (Archived),https://unfccc.int/sites/default/files/NDC/2022-06/Morocco%20First%20NDC.pdf,application/pdf,03d5f011e5faff7427269260a7e34e90,True,True,['Morocco'],MAR,['Nationally Determined Contribution'],2016-09-19,True,,UNFCCC.family.851.0,Morocco First NDC (Archived),morocco-first-ndc-archived_4a29,,,,215,36
UNFCCC.non-party.470.0,Facilitative sharing of views record - BUR2 Indonesia,https://unfccc.int/sites/default/files/resource/FSVR2_IDN.pdf,application/pdf,5de6ddb90381d715e14ea97446656169,False,True,['UNFCCC Secretariat'],nan,['Facilitative Sharing of Views Report'],2021-04-09,False,,UNFCCC.family.470.0,Facilitative sharing of views record - BUR2 Indonesia,facilitative-sharing-of-views-record-bur2-indonesia_5272,,,,35,3
UNFCCC.non-party.321.0,Compilation and synthesis of fourth biennial reports of Parties included in Annex I to the Convention. Revised report by the secretariat. Addendum,https://unfccc.int/sites/default/files/resource/sbi2020_inf10_add01_rev01.pdf,application/pdf,e9135def6ccdad34e28dc41a09287ca7,False,True,['UNFCCC Secretariat'],nan,['Pre-Session Document'],2022-05-13,False,,UNFCCC.family.321.0,Compilation and synthesis of fourth biennial reports of Parties included in Annex I to the Convention. Revised report by the secretariat. Addendum,compilation-and-synthesis-of-fourth-biennial-reports-of-parties-included-in-annex-i-to-the-convention-revised-report-by-the-secretariat-addendum_c457,,,,788,103
UNFCCC.non-party.221.0,CarbonCare InnoLab's Submission in Response to Call on: The first global stocktake,https://unfccc.int/sites/default/files/resource/202203011425---CCIL%20GST1%20Submissions%20to%20UNFCCC_Feb2022.pdf,application/pdf,aac0b64ef3fb5fbb3a9d4a382f518773,False,True,['CarbonCare InnoLab (CCIL)'],nan,['Submission to the Global Stocktake'],2022-04-13,False,,UNFCCC.family.221.0,CarbonCare InnoLab's Submission in Response to Call on: The first global stocktake,carboncare-innolab-s-submission-in-response-to-call-on-the-first-global-stocktake_08a7,,,,38,3
UNFCCC.party.951.0,Nigeria. Biennial update report (BUR). BUR2.,https://unfccc.int/sites/default/files/resource/NIGERIA%20BUR%202%20-%20Second%20Biennial%20Update%20Report%20%28BUR2%29.pdf,application/pdf,ad9e44e39a3474458f077280d35bb55e,False,True,['Nigeria'],NGA,['Biennial Update Report'],2021-09-28,True,,UNFCCC.family.951.0,Nigeria. Biennial update report (BUR). BUR2.,nigeria-biennial-update-report-bur-bur2_67c2,,,,1013,140
UNFCCC.party.832.0,Micronesia (Federated State of) First NDC,https://unfccc.int/sites/default/files/NDC/2022-06/Micronesia%20%28Federated%20State%20of%29%20First%20NDC.pdf,application/pdf,81e98b349f23cd0cf0c5e68c46216cb4,False,True,['Micronesia'],FSM,['Nationally Determined Contribution'],2016-09-15,True,,UNFCCC.family.832.0,Micronesia (Federated State of) First NDC,micronesia-federated-state-of-first-ndc_1716,,,,28,5
UNFCCC.party.932.0,New Zealand. National Communication (NC). NC 8.,https://unfccc.int/sites/default/files/resource/New-Zealands-Eighth-National-Communication.pdf,application/pdf,9a7e38b7f960154ae77aa83782272354,False,True,['New Zealand'],NZL,['National Communication'],2022-12-22,True,,UNFCCC.family.932.0,New Zealand. National Communication (NC). NC 8.,new-zealand-national-communication-nc-nc-8_65ec,,,,4591,486
UNFCCC.non-party.1186.0,Chapter 4: Land Degradation,https://www.ipcc.ch/site/assets/uploads/sites/4/2022/11/SRCCL_Chapter_4.pdf,application/pdf,c46dc34fdbd42ef082e7afd49350a391,False,True,['IPCC'],nan,['IPCC Report'],2019-08-01,False,,UNFCCC.family.1179.0,Special Report on Climate Change and Land,special-report-on-climate-change-and-land_70d5,,,,1132,92
UNFCCC.party.727.0,Latvia. 2022 National Inventory Report (NIR),https://unfccc.int/sites/default/files/resource/lva-2022-nir-14apr22_0.zip,,,True,False,['Latvia'],LVA,['National Inventory Report'],2022-04-14,True,,UNFCCC.family.727.0,Latvia. 2022 National Inventory Report (NIR),latvia-2022-national-inventory-report-nir_de02,,,,0,0
UNFCCC.non-party.1331.0,Technical analysis of the first biennial update report of Egypt submitted on 20 December 2019 Summary report by the team of technical experts,https://unfccc.int/sites/default/files/resource/tasr2020_EGY.pdf,application/pdf,e645f328e0f5f368d30a8b70b894d8b5,False,True,['UNFCCC Secretariat'],nan,['Technical Analysis Summary Report'],2022-03-21,False,,UNFCCC.family.1331.0,Technical analysis of the first biennial update report of Egypt submitted on 20 December 2019 Summary report by the team of technical experts,technical-analysis-of-the-first-biennial-update-report-of-egypt-submitted-on-20-december-2019-summary-report-by-the-team-of-technical-experts_170a,,,,181,23
UNFCCC.party.590.0,Guyana. National Communication (NC). NC 2.,https://unfccc.int/sites/default/files/resource/guync2.pdf,application/pdf,e547331831bf205dc5113f7df3bff9db,False,True,['Guyana'],GUY,['National Communication'],2012-09-24,True,,UNFCCC.family.590.0,Guyana. National Communication (NC). NC 2.,guyana-national-communication-nc-nc-2_e07f,,,,3856,437
UNFCCC.party.1300.0,Switzerland. 2021 National Inventory Report (NIR),https://unfccc.int/sites/default/files/resource/che-2021-nir-12apr21.zip,,,True,False,['Switzerland'],CHE,['National Inventory Report'],2021-04-12,True,,UNFCCC.family.1300.0,Switzerland. 2021 National Inventory Report (NIR),switzerland-2021-national-inventory-report-nir_6e8e,,,,0,0
UNFCCC.party.1420.0,Thailand. National Communication (NC). NC 3.,https://unfccc.int/sites/default/files/resource/Thailand%20TNC.pdf,application/pdf,6a39b29c2c28690a49bc8cf39b4bf05e,False,True,['Thailand'],THA,['National Communication'],2018-08-29,True,,UNFCCC.family.1420.0,Thailand. National Communication (NC). NC 3.,thailand-national-communication-nc-nc-3_b6bf,,,,1227,214
UNFCCC.party.1520.0,United Kingdom Adaptation Communication Update,https://unfccc.int/sites/default/files/resource/United%20Kingdom%20Update%20to%20the%20Adaptation%20Communication.pdf,application/pdf,ce173771cdeb4da3da6b0f2df2e54353,False,True,['United Kingdom'],GBR,['Adaptation Communication'],2021-10-19,True,,UNFCCC.family.1520.0,United Kingdom Adaptation Communication,united-kingdom-adaptation-communication_9a90,,,,19,3
UNFCCC.party.756.0,Lithuania. Biennial report (BR). BR 4,https://unfccc.int/sites/default/files/resource/BR4_2020_LT.pdf,application/pdf,90c9e629bf99e900f1b74a399a3a60ec,False,True,['Lithuania'],LTU,['Biennial Report'],2020-01-04,True,,UNFCCC.family.756.0,Lithuania. Biennial report (BR). BR 4,lithuania-biennial-report-br-br-4_5c6d,,,,1279,157
UNFCCC.non-party.41.0,Annual compilation and accounting report for Annex B Parties under the Kyoto Protocol for 2020. Note by the secretariat. Addendum. Compilation and accounting information by Party,https://unfccc.int/sites/default/files/resource/cmp2020_05a01.pdf,application/pdf,d12f7e47b0dd5ae83d5cf232acf06e79,False,True,['UNFCCC Secretariat'],nan,['Report'],2020-11-13,False,,UNFCCC.family.41.0,Annual compilation and accounting report for Annex B Parties under the Kyoto Protocol for 2020. Note by the secretariat. Addendum. Compilation and accounting information by Party,annual-compilation-and-accounting-report-for-annex-b-parties-under-the-kyoto-protocol-for-2020-note-by-the-secretariat-addendum-compilation-and-accounting-information-by-party_5287,,,,648,93
UNFCCC.non-party.1340.0,Technical analysis of the first biennial update report of Mongolia submitted on 30 August 2017. Summary report by the team of technical experts,https://unfccc.int/sites/default/files/resource/tasr12017_mng.pdf,application/pdf,21aa15adb8a0947f4be9726a5ec3ed8b,False,True,['UNFCCC Secretariat'],nan,['Technical Analysis Summary Report'],2018-06-11,False,,UNFCCC.family.1340.0,Technical analysis of the first biennial update report of Mongolia submitted on 30 August 2017. Summary report by the team of technical experts,technical-analysis-of-the-first-biennial-update-report-of-mongolia-submitted-on-30-august-2017-summary-report-by-the-team-of-technical-experts_33ea,,,,162,21
UNFCCC.non-party.1411.0,"Technical report on the technical analysis of the technical annex to the fourth biennial update report of Brazil submitted in accordance with decision 14/CP.19, paragraph 7, on 31 December 2020 - Part 1",https://unfccc.int/sites/default/files/resource/tatr6_2021_BRA.pdf,application/pdf,94eb2bda0fcc580a601a7353372e8eaa,False,True,['UNFCCC Secretariat'],nan,['Technical Analysis Technical Report'],2022-04-21,False,,UNFCCC.family.1411.0,"Technical report on the technical analysis of the technical annex to the fourth biennial update report of Brazil submitted in accordance with decision 14/CP.19, paragraph 7, on 31 December 2020",technical-report-on-the-technical-analysis-of-the-technical-annex-to-the-fourth-biennial-update-report-of-brazil-submitted-in-accordance-with-decision-14-cp-19-paragraph-7-on-31-december-2020_adf5,,,,125,14
UNFCCC.party.656.0,Israel First NDC (Archived),https://unfccc.int/sites/default/files/NDC/2022-06/Israel%20INDC.pdf,application/pdf,d2e541ac46f186ee7cd047bd7469a9e1,False,True,['Israel'],ISR,['Nationally Determined Contribution'],2016-11-22,True,,UNFCCC.family.656.0,Israel First NDC (Archived),israel-first-ndc-archived_f1d0,,,,42,5
UNFCCC.party.107.0,Bangladesh First NDC (Interim-Updated submission),https://unfccc.int/sites/default/files/NDC/2022-06/Updated_NDC_of_Bangladesh.pdf,application/pdf,4e0f09d7bd65ce9131fc5549b22748be,False,True,['Bangladesh'],BGD,['Nationally Determined Contribution'],2020-12-31,True,,UNFCCC.family.107.0,Bangladesh First NDC (Interim-Updated submission),bangladesh-first-ndc-interim-updated-submission_3ea2,,,,60,18
UNFCCC.non-party.1240.0,Submission by the Global CCS Institute to the first Global Stocktake,https://unfccc.int/sites/default/files/resource/202208101609---GCCSI_GST-2TDSubmission-Aug2022.pdf,application/pdf,eb21461c3e878c9952ee6c08ccddf764,False,True,['Global CCS Institute'],nan,['Submission to the Global Stocktake'],2022-08-15,False,,UNFCCC.family.1240.0,Submission by the Global CCS Institute to the first Global Stocktake,submission-by-the-global-ccs-institute-to-the-first-global-stocktake_b608,,,,37,5
UNFCCC.non-party.562.0,"Global Stocktake Submission: ""Country"" of Permafrost Submission from Stockholm University, Sweden",https://unfccc.int/sites/default/files/resource/202203012111---GST%20Submission%20Permafrost%20Stockholm%20University%20220228_v2.pdf,application/pdf,f5914596edb24513f2fe86a6cb94fe2a,False,True,['Stockholm University'],nan,['Submission to the Global Stocktake'],2022-04-01,False,,UNFCCC.family.562.0,"Global Stocktake Submission: ""Country"" of Permafrost Submission from Stockholm University, Sweden",global-stocktake-submission-country-of-permafrost-submission-from-stockholm-university-sweden_fab0,,,,50,5
UNFCCC.party.943.0,Niger First NDC (Archived),https://unfccc.int/sites/default/files/NDC/2022-06/Niger-INDC-versionfinale.pdf,application/pdf,8ea539d4549717549b6a1e67f37adf6f,True,True,['Niger'],NER,['Nationally Determined Contribution'],2016-09-21,True,,UNFCCC.family.942.0,Niger First NDC (Archived),niger-first-ndc-archived_cc70,,,,132,17
UNFCCC.party.843.0,Mongolia. Biennial update report (BUR). BUR 1. National inventory report.,https://unfccc.int/sites/default/files/resource/64281305_Mongolia-BUR1-1-NIR%20Mongolia%20082017.pdf,application/pdf,fbacfa183b1416848c4ca7f2fb90ab04,False,True,['Mongolia'],MNG,['National Inventory Report'],2017-08-06,True,,UNFCCC.family.843.0,Mongolia. Biennial update report (BUR). BUR 1. National inventory report.,mongolia-biennial-update-report-bur-bur-1-national-inventory-report_39e3,,,,1158,123
UNFCCC.non-party.333.0,Constituted Body GST synthesis report: Inputs to the technical assessment component of the first global stocktake on the impacts of the implementation of response measures,https://unfccc.int/sites/default/files/resource/KCI_GST_synthesis_report_2022.pdf,application/pdf,797b9799995abb7765a97edf32111349,False,True,['UNFCCC Katowice Committee of Experts on Impact of Implementation of Response Measures'],nan,['Synthesis Report'],2022-03-03,False,,UNFCCC.family.333.0,Constituted Body GST synthesis report: Inputs to the technical assessment component of the first global stocktake on the impacts of the implementation of response measures,constituted-body-gst-synthesis-report-inputs-to-the-technical-assessment-component-of-the-first-global-stocktake-on-the-impacts-of-the-implementation-of-response-measures_cf0c,,,,90,7
UNFCCC.non-party.462.0,Facilitative sharing of views record - BUR1 El-Salvador,https://unfccc.int/sites/default/files/resource/FSVR1_SLV.pdf,application/pdf,68e25768c488c8895242008689ddea16,False,True,['UNFCCC Secretariat'],nan,['Facilitative Sharing of Views Report'],2021-04-09,False,,UNFCCC.family.462.0,Facilitative sharing of views record - BUR1 El-Salvador,facilitative-sharing-of-views-record-bur1-el-salvador_c722,,,,42,3
UNFCCC.non-party.250.0,Climate Action Pathway: Energy. Action Table,https://unfccc.int/sites/default/files/resource/Energy_ActionTable_2.1_0.pdf,application/pdf,a84945d525f98dcd5d9f1046c92e7c6e,False,True,['Climate Action Pathway: Energy'],nan,['Publication'],2021-06-24,False,,UNFCCC.family.250.0,Climate Action Pathway: Energy. Action Table,climate-action-pathway-energy-action-table_c7fd,,,,576,55
UNFCCC.party.920.0,Netherlands. National Communication (NC). NC 7.,https://unfccc.int/sites/default/files/resource/Seventh%20Netherlands%20National%20Communication%20under%20the%20UNFCCC%20update%202018.pdf,application/pdf,23702ff87dd66cd3a48ea0a6bc7dd699,False,True,['Netherlands'],NLD,['National Communication'],2018-02-14,True,,UNFCCC.family.920.0,Netherlands. National Communication (NC). NC 7.,netherlands-national-communication-nc-nc-7_c9a0,,,,2052,260
UNFCCC.party.820.0,Meeting the Fast Start Commitment: U.S. Climate Finance in Fiscal Year 2012,http://unfccc.int/files/cooperation_support/financial_mechanism/fast_start_finance/application/pdf/cop_fsf_usa_2013.pdf,application/pdf,746d41270f2227c75e56e151bf81531d,False,True,['United States of America'],USA,['Fast-Start Finance Report'],2013-09-02,True,,UNFCCC.family.820.0,Meeting the Fast Start Commitment: U.S. Climate Finance in Fiscal Year 2012,meeting-the-fast-start-commitment-u-s-climate-finance-in-fiscal-year-2012_fd7c,,,,110,16
UNFCCC.non-party.1323.0,Technical analysis of the first biennial update report of Antigua and Barbuda submitted on 3 March 2020. Summary report by the team of technical experts,https://unfccc.int/sites/default/files/resource/tasr2020_ATG.pdf,application/pdf,828b733512c39cf7ff2b08ebbb79dbae,False,True,['UNFCCC Secretariat'],nan,['Technical Analysis Summary Report'],2021-02-10,False,,UNFCCC.family.1323.0,Technical analysis of the first biennial update report of Antigua and Barbuda submitted on 3 March 2020. Summary report by the team of technical experts,technical-analysis-of-the-first-biennial-update-report-of-antigua-and-barbuda-submitted-on-3-march-2020-summary-report-by-the-team-of-technical-experts_1d2d,,,,199,25
UNFCCC.party.582.0,Guinea First NDC (Archived),https://unfccc.int/sites/default/files/NDC/2022-06/INDC_Guinea_english_version%20UNFCCC.pdf,application/pdf,08b65e59d8d4898edeb867a664891baf,False,True,['Guinea'],GIN,['Nationally Determined Contribution'],2016-09-21,True,,UNFCCC.family.582.0,Guinea First NDC (Archived),guinea-first-ndc-archived_fb41,,,,139,15
